<?xml version="1.0" encoding="UTF-8"?>
<CausalChain xmlns:xsi="http://www.w3.org/2001/XMLSchema-instance" xsi:noNamespaceSchemaLocation="causalchain.xsd">
	<Attack>
		<Element>
			<Actor>PayloadComputer</Actor>
			<ElementName>Elements(0)</ElementName>
			<MethodName/>
			<Realm>L</Realm>
			<Si/>
			<Sn/>
			<Element>
				<Actor>PayloadComputer</Actor>
				<ElementName>Elements(1)</ElementName>
				<MethodName/>
				<Realm>L</Realm>
				<Si/>
				<Sn/>
			</Element>
		</Element>
		<Element>
			<Actor>Command/DataComp</Actor>
			<ElementName>Elements(0)</ElementName>
			<MethodName/>
			<Realm>L</Realm>
			<Si/>
			<Sn/>
			<Element>
				<Actor>Command/DataComp</Actor>
				<ElementName>Elements(1)</ElementName>
				<MethodName/>
				<Realm>L</Realm>
				<Si/>
				<Sn/>
			</Element>
		</Element>
		<!-- main channel -->
		<Element>
			<Actor>MaliciousActor</Actor>
			<ElementName>Elements(0)</ElementName>
			<MethodName>Methods(0)</MethodName>
			<Realm>H</Realm>
			<Si>S1i</Si>
			<Sn>S1n</Sn>
			<Effects>
				<Action>
					<Category>1</Category>
					<Name>A1</Name>
				</Action>
				<Cause>
					<Category>1</Category>
					<Name>C1</Name>
				</Cause>
				<StateTransion>
					<Category>1</Category>
					<Name>S1</Name>
				</StateTransion>
			</Effects>
			<Element>
				<Actor>MaliciousRSO</Actor>
				<ElementName>Elements(2)</ElementName>
				<MethodName>Methods(2)</MethodName>
				<Realm>P</Realm>
				<Si>S2i</Si>
				<Sn>S2n</Sn>
				<Element>
					<Actor>Camera</Actor>
					<ElementName>Element(3)</ElementName>
					<MethodName/>
					<Realm>T</Realm>
					<Si/>
					<Sn/>
					<Element>
						<Actor>PayloadComputer</Actor>
						<ElementName>Element(4)</ElementName>
						<MethodName/>
						<Realm>L</Realm>
						<Si/>
						<Sn/>
						<Element>
							<Actor>Command/DataComp</Actor>
							<ElementName>Element(5)</ElementName>
							<MethodName/>
							<Realm>L</Realm>
							<Si/>
							<Sn/>
							<Element>
								<Actor>SecureRadio</Actor>
								<ElementName>Element(6)</ElementName>
								<MethodName/>
								<Realm>T</Realm>
								<Si/>
								<Sn/>
								<Element>
									<Actor>MaliciousActor</Actor>
									<ElementName>Element(7)</ElementName>
									<MethodName/>
									<Realm>H</Realm>
									<Si/>
									<Sn/>
									<Element>
										<Actor>SecureRadio</Actor>
										<ElementName>Element(8)</ElementName>
										<MethodName/>
										<Realm>T</Realm>
										<Si/>
										<Sn/>
										<Element>
											<Actor>Command/DataComp</Actor>
											<ElementName>Element(9)</ElementName>
											<MethodName/>
											<Realm>L</Realm>
											<Si/>
											<Sn/>
											<Element>
												<Actor>PropValveActuator</Actor>
												<ElementName>Element(10)</ElementName>
												<MethodName/>
												<Realm>T</Realm>
												<Si/>
												<Sn/>
												<Element>
													<Actor>PropulsionSystem</Actor>
													<ElementName>Element(11)</ElementName>
													<MethodName/>
													<Realm>P</Realm>
													<Si/>
													<Sn/>
													<Element>
														<Actor>NanosatMass</Actor>
														<ElementName>Element(12)</ElementName>
														<MethodName/>
														<Realm>P</Realm>
														<Si/>
														<Sn/>
														<Element>
															<Actor>MaliciosRSO</Actor>
															<ElementName>Element(13)</ElementName>
															<MethodName/>
															<Realm>P</Realm>
															<Si/>
															<Sn/>
															<Element>
																<Actor>HVA</Actor>
																<ElementName>Element(14)</ElementName>
																<MethodName/>
																<Realm>P</Realm>
																<Si/>
																<Sn/>
															</Element>
														</Element>
													</Element>
												</Element>
											</Element>
										</Element>
									</Element>
								</Element>
								<Element>
									<Actor>GroundTeam</Actor>
									<ElementName/>
									<MethodName/>
									<Realm/>
									<Si/>
									<Sn/>
								</Element>
							</Element>
						</Element>
					</Element>
				</Element>
			</Element>
		</Element>
	</Attack>
</CausalChain>
